{
  "$schema": "http://json-schema.org/draft-07/schema#",
  "title": "Safety Finding",
  "description": "Audit finding record for Safety OS evidence trail",
  "version": "2.1.0",
  "type": "object",
  "required": ["id", "date", "type", "description", "legal_basis", "severity", "status"],
  "properties": {
    "id": { "type": "string", "pattern": "^FIND-[0-9]{4}-[0-9]{4}$" },
    "date": { "type": "string", "format": "date" },
    "type": { "type": "string", "enum": ["hazard", "non-conformance", "near-miss", "incident"] },
    "description": { "type": "string" },
    "legal_basis": { "type": "array", "items": { "type": "string" }, "minItems": 3, "description": "Applicable law articles — minimum 3 regulatory sources" },
    "severity": { "type": "string", "enum": ["critical", "major", "minor", "observation"] },
    "location": { "type": "string" },
    "responsible_party": { "type": "string" },
    "agent_id": { "$ref": "common.schema.json#/definitions/agent_id", "description": "Optional (v2.1): agent attribution. Not required because legacy records predate agent attribution and carry no audit_trail to derive it from (zero-fabrication rule)." },
    "workflow_id": { "$ref": "common.schema.json#/definitions/workflow_id", "description": "Optional (v2.1): workflow execution reference. Findings originate from audit sessions, not dispatched workflows — never invent an ID to satisfy this field." },
    "status": { "type": "string", "enum": ["open", "in-progress", "closed", "verified"] },
    "corrective_action_id": { "type": "string", "pattern": "^CA-[0-9]{4}-[0-9]{4}$" }
  }
}
